{
  "ok": true,
  "chain": "evm",
  "runner": "forge",
  "startedAt": "2026-02-21T06:31:08.998Z",
  "finishedAt": "2026-02-21T06:31:09.208Z",
  "command": "forge test",
  "exitCode": 0,
  "summary": "✅ Tests passed (0 passing)",
  "details": {
    "passed": 0,
    "failed": 0,
    "errors": []
  }
}