{
  "ok": false,
  "chain": "evm",
  "runner": "forge",
  "startedAt": "2026-02-21T07:28:07.127Z",
  "finishedAt": "2026-02-21T07:28:07.386Z",
  "command": "forge test",
  "exitCode": 1,
  "summary": "❌ Tests failed (1 failing)",
  "details": {
    "passed": 1,
    "failed": 1,
    "errors": [],
    "failures": [
      {
        "reason": "Error != expected error: Must send ETH != Wrong message",
        "test": "testDepositZeroFails()"
      },
      {
        "reason": "Error != expected error: Must send ETH != Wrong message",
        "test": "testDepositZeroFails()"
      }
    ]
  }
}